{
  "$schema": "https://json-schema.org/draft/2020-12/schema",
  "$id": "urn:dsh-community-market:schema:catalog-snapshot:1.0.0",
  "title": "DSH Community Market normalized catalog snapshot",
  "description": "A normalized, non-executable page produced locally by a catalog adapter. Host-observed provenance is retained for every item.",
  "type": "object",
  "additionalProperties": false,
  "required": [
    "schemaVersion",
    "source",
    "items",
    "page"
  ],
  "properties": {
    "schemaVersion": {
      "const": "1.0.0"
    },
    "source": {
      "$ref": "#/$defs/source"
    },
    "items": {
      "type": "array",
      "maxItems": 100,
      "items": {
        "$ref": "#/$defs/item"
      }
    },
    "page": {
      "$ref": "#/$defs/page"
    }
  },
  "$defs": {
    "providerId": {
      "type": "string",
      "minLength": 3,
      "maxLength": 128,
      "pattern": "^[a-z0-9]+(?:[.-][a-z0-9]+)+$"
    },
    "sourceRecordId": {
      "type": "string",
      "format": "uuid",
      "description": "Opaque local registration identity generated by the Host, never supplied by a provider."
    },
    "identifier": {
      "type": "string",
      "minLength": 1,
      "maxLength": 160,
      "pattern": "^[A-Za-z0-9][A-Za-z0-9._:/@+-]*$"
    },
    "httpsUri": {
      "type": "string",
      "format": "uri",
      "maxLength": 2048,
      "pattern": "^https://(?![^/?#]*@)(?![^/?#]*:)[^#]+$"
    },
    "plainText": {
      "type": "string",
      "pattern": "^[^\\u0000-\\u001F\\u007F-\\u009F\\u202A-\\u202E\\u2066-\\u2069]*$"
    },
    "mediaAlt": {
      "allOf": [
        {
          "$ref": "#/$defs/plainText"
        },
        {
          "type": "string",
          "minLength": 1,
          "maxLength": 240
        }
      ]
    },
    "assetRef": {
      "type": "string",
      "description": "An opaque Host-managed media reference. It is neither a remote URL nor a filesystem path and is the only media locator exposed to the Renderer.",
      "minLength": 39,
      "maxLength": 39,
      "pattern": "^mktimg_[A-Za-z0-9_-]{32}$"
    },
    "resolvedIcon": {
      "type": "object",
      "description": "A Host-resolved icon safe for Renderer consumption. The role distinguishes a plugin-owned icon from a publisher-avatar fallback.",
      "additionalProperties": false,
      "required": [
        "assetRef",
        "role"
      ],
      "properties": {
        "assetRef": {
          "$ref": "#/$defs/assetRef"
        },
        "role": {
          "enum": [
            "plugin-icon",
            "publisher-avatar"
          ]
        },
        "alt": {
          "$ref": "#/$defs/mediaAlt"
        }
      }
    },
    "media": {
      "type": "object",
      "description": "Optional Host-resolved plugin media. Draft v1 standardizes only the icon slot.",
      "additionalProperties": false,
      "required": [
        "icon"
      ],
      "properties": {
        "icon": {
          "$ref": "#/$defs/resolvedIcon"
        }
      }
    },
    "source": {
      "type": "object",
      "additionalProperties": false,
      "required": [
        "sourceRecordId",
        "providerId",
        "adapterId",
        "registrationKind",
        "fetchedAt",
        "finalUrl"
      ],
      "properties": {
        "sourceRecordId": {
          "$ref": "#/$defs/sourceRecordId"
        },
        "providerId": {
          "$ref": "#/$defs/providerId"
        },
        "adapterId": {
          "type": "string",
          "minLength": 1,
          "maxLength": 96,
          "pattern": "^[a-z0-9]+(?:[.-][a-z0-9]+)+$"
        },
        "registrationKind": {
          "enum": [
            "user-added",
            "built-in"
          ]
        },
        "fetchedAt": {
          "type": "string",
          "format": "date-time"
        },
        "finalUrl": {
          "$ref": "#/$defs/httpsUri"
        },
        "providerGeneratedAt": {
          "type": "string",
          "format": "date-time"
        },
        "providerRevision": {
          "type": "string",
          "minLength": 1,
          "maxLength": 160
        }
      }
    },
    "page": {
      "type": "object",
      "additionalProperties": false,
      "properties": {
        "nextCursor": {
          "type": "string",
          "minLength": 1,
          "maxLength": 2048
        },
        "total": {
          "type": "integer",
          "minimum": 0
        }
      }
    },
    "provenance": {
      "type": "object",
      "additionalProperties": false,
      "required": [
        "sourceRecordId",
        "providerId",
        "itemId"
      ],
      "properties": {
        "sourceRecordId": {
          "$ref": "#/$defs/sourceRecordId"
        },
        "providerId": {
          "$ref": "#/$defs/providerId"
        },
        "itemId": {
          "$ref": "#/$defs/identifier"
        }
      }
    },
    "repository": {
      "type": "object",
      "additionalProperties": false,
      "required": [
        "url"
      ],
      "properties": {
        "url": {
          "$ref": "#/$defs/httpsUri"
        },
        "subdirectory": {
          "type": "string",
          "minLength": 1,
          "maxLength": 240,
          "pattern": "^(?!/)(?!.*(?:^|/)\\.\\.(?:/|$))[^\\\\]+$"
        }
      }
    },
    "package": {
      "type": "object",
      "additionalProperties": false,
      "required": [
        "registry",
        "name"
      ],
      "properties": {
        "registry": {
          "const": "npm"
        },
        "name": {
          "type": "string",
          "minLength": 1,
          "maxLength": 214,
          "pattern": "^(?:@[a-z0-9][a-z0-9._-]*/)?[a-z0-9][a-z0-9._-]*$"
        }
      }
    },
    "publisher": {
      "type": "object",
      "additionalProperties": false,
      "required": [
        "name"
      ],
      "properties": {
        "name": {
          "allOf": [
            {
              "$ref": "#/$defs/plainText"
            },
            {
              "type": "string",
              "minLength": 1,
              "maxLength": 120
            }
          ]
        },
        "url": {
          "$ref": "#/$defs/httpsUri"
        }
      }
    },
    "capabilities": {
      "type": "object",
      "additionalProperties": false,
      "properties": {
        "required": {
          "$ref": "#/$defs/capabilityList"
        },
        "optional": {
          "$ref": "#/$defs/capabilityList"
        }
      }
    },
    "capabilityList": {
      "type": "array",
      "maxItems": 64,
      "uniqueItems": true,
      "items": {
        "type": "string",
        "minLength": 1,
        "maxLength": 96,
        "pattern": "^[a-z][a-z0-9-]*(?:\\.[a-z][a-z0-9-]*)+$"
      }
    },
    "categoryId": {
      "type": "string",
      "minLength": 1,
      "maxLength": 64,
      "pattern": "^[a-z0-9][a-z0-9._:-]*$"
    },
    "compatibility": {
      "type": "object",
      "additionalProperties": false,
      "properties": {
        "apiVersion": {
          "type": "string",
          "minLength": 1,
          "maxLength": 64
        },
        "hosts": {
          "type": "array",
          "maxItems": 32,
          "uniqueItems": true,
          "items": {
            "type": "string",
            "minLength": 1,
            "maxLength": 96
          }
        }
      }
    },
    "item": {
      "type": "object",
      "additionalProperties": false,
      "required": [
        "id",
        "name",
        "displayName",
        "summary",
        "provenance"
      ],
      "properties": {
        "id": {
          "$ref": "#/$defs/identifier"
        },
        "name": {
          "allOf": [
            {
              "$ref": "#/$defs/plainText"
            },
            {
              "type": "string",
              "minLength": 1,
              "maxLength": 160
            }
          ]
        },
        "displayName": {
          "allOf": [
            {
              "$ref": "#/$defs/plainText"
            },
            {
              "type": "string",
              "minLength": 1,
              "maxLength": 120
            }
          ]
        },
        "summary": {
          "allOf": [
            {
              "$ref": "#/$defs/plainText"
            },
            {
              "type": "string",
              "minLength": 1,
              "maxLength": 1000
            }
          ]
        },
        "description": {
          "allOf": [
            {
              "$ref": "#/$defs/plainText"
            },
            {
              "type": "string",
              "maxLength": 5000
            }
          ]
        },
        "homepage": {
          "$ref": "#/$defs/httpsUri"
        },
        "latestVersion": {
          "type": "string",
          "minLength": 1,
          "maxLength": 64
        },
        "license": {
          "type": "string",
          "minLength": 1,
          "maxLength": 80
        },
        "categories": {
          "type": "array",
          "maxItems": 32,
          "uniqueItems": true,
          "items": {
            "$ref": "#/$defs/categoryId"
          }
        },
        "keywords": {
          "type": "array",
          "maxItems": 64,
          "uniqueItems": true,
          "items": {
            "type": "string",
            "minLength": 1,
            "maxLength": 64
          }
        },
        "repository": {
          "$ref": "#/$defs/repository"
        },
        "package": {
          "$ref": "#/$defs/package"
        },
        "publisher": {
          "$ref": "#/$defs/publisher"
        },
        "media": {
          "$ref": "#/$defs/media"
        },
        "capabilities": {
          "$ref": "#/$defs/capabilities"
        },
        "compatibility": {
          "$ref": "#/$defs/compatibility"
        },
        "updatedAt": {
          "type": "string",
          "format": "date-time"
        },
        "provenance": {
          "$ref": "#/$defs/provenance"
        }
      },
      "anyOf": [
        {
          "properties": {
            "repository": true
          },
          "required": [
            "repository"
          ]
        },
        {
          "properties": {
            "package": true
          },
          "required": [
            "package"
          ]
        }
      ]
    }
  }
}
